{
  "specversion": "0.2.0",
  "id": "evt_fix_task_created_001",
  "time": "2026-01-01T10:00:00Z",
  "source": "agent://test/orchestrator",
  "type": "task.created",
  "session_id": "ses_fix_001",
  "trace_id": "trc_fix_001",
  "agent_role": "orchestrator",
  "payload": {
    "task": "Summarise quarterly report",
    "priority": "high"
  }
}
