{
  "specversion": "0.2.0",
  "id": "evt_fix_task_completed_001",
  "time": "2026-01-01T10:05:00Z",
  "source": "agent://test/orchestrator",
  "type": "task.completed",
  "session_id": "ses_fix_001",
  "trace_id": "trc_fix_001",
  "causation_id": "evt_fix_task_created_001",
  "agent_role": "orchestrator",
  "payload": {
    "result": "Summary produced successfully",
    "duration_ms": 4200
  }
}
