{
  "specversion": "0.2.0",
  "id": "evt_fix_handoff_start_001",
  "time": "2026-01-01T10:03:00Z",
  "source": "agent://test/orchestrator",
  "type": "handoff.started",
  "session_id": "ses_fix_001",
  "trace_id": "trc_fix_001",
  "agent_role": "orchestrator",
  "payload": {
    "to_agent": "agent://test/subagent-b",
    "context": { "partial_result": "Revenue data collected" }
  }
}
