{
  "specversion": "0.2.0",
  "id": "evt_fix_tool_called_001",
  "time": "2026-01-01T10:01:00Z",
  "source": "agent://test/subagent",
  "type": "tool.called",
  "session_id": "ses_fix_002",
  "trace_id": "trc_fix_001",
  "parent_session_id": "ses_fix_001",
  "agent_role": "subagent",
  "payload": {
    "tool": "web_search",
    "input": { "query": "Q3 revenue figures" }
  }
}
